case,justice,text,text_count,token_count,sentence_count,sentence_length_mean,sentence_length_std,unique_terms,sw_pct,fw_count,function_words,quote_count,avg_qps,entity_count,entity_ratio,entity_list,mtld,hdd,dale_chall,fw_their,fw_once,fw_this,fw_per,fw_below,fw_beneath,fw_both,fw_he,fw_onto,fw_inside,fw_many,fw_down,fw_because,fw_mine,fw_between,fw_somebody,fw_something,fw_if,fw_against,fw_either,fw_any,fw_as,fw_from,fw_through,fw_without,fw_someone,fw_another,fw_off,fw_before,fw_the,fw_in,fw_these,fw_each,fw_during,fw_whether,fw_about,fw_under,fw_whose,fw_since,fw_no,fw_opposite,fw_therefore,fw_everyone,fw_her,fw_upon,fw_above,fw_toward,fw_few,fw_over,fw_those,fw_so,fw_one,fw_its,fw_our,fw_none,fw_they,fw_yet,fw_wherever,fw_outside,fw_anybody,fw_that,fw_she,fw_within,fw_what,fw_less,fw_and,fw_thus,fw_near,fw_while,fw_at,fw_though,fw_you,fw_everything,fw_anything,fw_it,fw_to,fw_which,fw_nor,fw_past,fw_all,fw_by,fw_into,fw_every,fw_ahead,fw_your,fw_his,fw_who,fw_behind,fw_or,fw_along,fw_like,fw_after,fw_than,fw_up,fw_several,fw_we,fw_some,fw_neither,fw_of,fw_where,fw_unless,fw_other,fw_whatever,fw_except,fw_whoever,fw_with,fw_nobody,fw_around,fw_my,fw_underneath,fw_besides,fw_but,fw_on,fw_until,fw_round,fw_across,fw_among,fw_beyond,fw_although,fw_a,fw_beside,fw_whom,fw_however,fw_nothing,fw_whenever,fw_bar,fw_save,fw_when,fw_whichever,fw_anyone,fw_for,fw_i,avg_word_length
case-562-594,unknown," A California convicted Steven Frank Jackson of numerous sexual offenses stemming from his attack on a -year-old woman who lived in his apartment complex. Jackson raised a Batson asserting that the exercised peremptory challenges to exclude black prospective s on the basis of their race. See Batson versus Kentucky, U.S. ). Two of three black s had been struck; the third served on the appendix to petition for of Jackson's did not object when the struck the first of the black s, S. later explained that he did not make a QUOTED TEXT because he thought the excusal of QUOTED TEXT After the sought to dismiss the second J, Jackson's made the Batson motion challenging both strikes. Record in Number -cv -RJB (ED California), Doc. Lodged Doc. The offered a race-neutral explanation for striking each had stated that from the ages of to years old, he was frequently stopped by California police officers because in his view of his race and age. As the put it, QUOTED TEXT Id., at Record in Number -cv -RJB (ED California), Doc. Lodged Doc. The stated that he struck because she had a master's degree in social work, and had interned at the county jail, QUOTED TEXT The explained that he dismissed her QUOTED TEXT stating that he does not QUOTED TEXT Document at Document at appendix to petition for of Jackson's expressly disagreed only with the 's explanation for the strike of J, see appendix to petition for of , arguing that removing her on the basis of her educational background was QUOTED TEXT The responded that he was not aware that social workers were a QUOTED TEXT As for S, Jackson's explained that he QUOTED TEXT because he anticipated the 's response and, in any event, he QUOTED TEXT a Batson motion. After listening to each side's arguments, the court denied Jackson's motion. Jackson renewed his Batson on direct arguing that a comparative analysis revealed that the 's explanations were pretextual. With respect to S, Jackson argued that a non-black -also had negative experiences with law enforcement but remained on the appendix to petition for of stated during selection that he had been stopped while driving in Illinois several years earlier as part of what he believed to be a QUOTED TEXT by Illinois police targeting drivers with California license plates. also complained that he had been disappointed by the failure of law enforcement officers to investigate the of his car. With respect to J, Jackson ed that the asked follow-up questions of several white s when he was concerned about their educational backgrounds, but struck without asking her any questions about her degree in social work. appendix to petition for of The California Court of upheld the court's denial of the Batson motion and affirmed Jackson's convictions. The appellate court explained that QUOTED TEXT appendix to petition for of (internal quotation marks omitted), which the California courts have characterized as equivalent to the QUOTED TEXT standard employed by federal courts, see, e.g., People versus Alvarez, California th , P. ). With respect to whether the 's stated reasons were pretextual, the court explained that it QUOTED TEXT appendix to petition for of After comparing to the court concluded that QUOTED TEXT Id., at As for J, the court recognized that the 's dismissal was based on her social services background-QUOTED TEXT and that this explained his different treatment of s with QUOTED TEXT The court also noted that the QUOTED TEXT at the county jail. After the California denied Jackson's petition for review, Jackson sought federal habeas relief. The Federal District Court properly recognized that review of Jackson's was governed by the Antiterrorism and Effective Death Act of (AEDPA). That law provides, in pertinent part, that federal habeas relief may not be granted unless the state court adjudication QUOTED TEXT U.S.C. ). After considering the state Court of decision and reviewing the record evidence, the District Court held that the California Court of 's findings were not unreasonable. appendix to petition for of The District Court therefore denied Jackson's petition. The Court of s for the Ninth reversed in a three-paragraph unpublished memorandum opinion. In so doing, the court did not discuss any specific facts or mention the reasoning of the other three courts that had rejected Jackson's Instead, after setting forth the basic background legal principles in the first two paragraphs, the Court of s offered a one- conclusory explanation for its decision: QUOTED TEXT Id., at That decision is as inexplicable as it is unexplained. It is reversed. The Batson issue before us turns largely on an QUOTED TEXT U.S. at n. The court's is entitled to QUOTED TEXT ibid., and QUOTED TEXT Snyder versus Louisiana, U.S. ). That is the standard on direct review. On federal habeas review, AEDPA QUOTED TEXT and QUOTED TEXT Renico versus Lett, U.S. (slip opinion, at (internal quotation marks omitted). Here the court credited the 's race-neutral explanations, and the California Court of carefully reviewed the record at some length in upholding the court's findings. The state appellate court's decision was plainly not unreasonable. There was simply no basis for the Ninth to reach the opposite conclusion, particularly in such a dismissive manner. The petition for and the motion for leave to proceed in forma pauperis are granted. The judgment of the Court of s for the Ninth is reversed, and the case is remanded for further proceedings consistent with this opinion. It is so ordered.",6462,1029,46,21.83,11.69,343,43.05,345,"A,of,from,his,on,a,who,in,his,a,that,the,to,on,the,of,their,of,the,on,the,to,for,of,when,the,the,of,the,that,he,a,because,he,the,of,After,the,to,the,the,both,in,The,a,for,each,that,from,the,of,to,he,by,because,in,his,of,his,and,As,the,it,at,in,The,that,he,because,she,a,in,and,at,the,The,that,he,her,that,he,at,at,to,for,of,with,the,for,the,of,to,for,of,that,her,on,the,of,her,The,that,he,that,a,As,for,that,he,because,he,the,and,in,any,he,a,After,to,each,the,his,on,that,a,that,the,With,to,that,a,with,but,on,the,to,for,of,during,that,he,while,in,several,as,of,what,he,to,a,by,with,that,he,by,the,of,to,the,of,his,With,to,that,the,up,of,several,when,he,about,their,but,without,her,any,about,her,in,to,for,of,The,of,the,of,the,and,The,that,to,for,of,which,the,as,to,the,by,With,to,whether,the,the,that,it,to,for,of,After,to,the,that,at,As,for,the,that,the,on,her,and,that,this,his,of,with,The,that,the,at,the,After,the,for,The,that,of,by,the,and,of,That,in,that,unless,the,After,the,of,and,the,the,that,the,of,to,for,of,The,therefore,The,of,for,the,in,a,In,so,the,any,or,the,of,the,other,that,after,the,in,the,the,of,a,one,for,its,at,That,as,as,it,It,The,before,on,at,The,to,and,That,the,on,On,and,at,the,the,and,the,of,the,at,some,in,the,The,no,for,the,to,the,opposite,in,a,The,for,and,the,for,to,in,The,of,the,of,for,the,and,the,for,with,this,It,so",0,0.0,88,8.55,"claim,certiorari,Counsel,trial,Juror,appeal,burglary,jury,prosecutor,respondent,writ,Penalty,Supreme Court,determination,counsel,sentence,juror,Appeal,Circuit,Court of Appeal",61.07,0.81,9.06,2,0,2,0,0,0,1,14,0,0,0,0,4,0,0,0,0,0,0,0,3,7,2,0,1,0,0,0,1,76,15,0,2,1,1,2,0,0,0,1,1,1,0,6,0,0,0,0,0,0,2,1,1,0,0,0,0,0,0,0,29,1,0,1,0,12,0,0,1,10,0,0,0,0,5,22,1,0,0,0,5,0,0,0,0,7,1,0,1,0,0,6,0,1,2,0,1,0,34,0,1,1,0,0,0,8,0,0,0,0,0,2,10,0,0,0,0,0,0,14,0,0,0,0,0,0,0,2,0,0,20,0,4.923
case-568-17,unknown," State courts rather than federal courts are most frequently called upon to apply the Federal Act U.S.C. et seq., including the Act's national policy favoring It is a matter of great importance, therefore, that state supreme courts adhere to a correct interpretation of the legislation. Here, the Oklahoma failed to do so. By declaring the noncompetition agreements in two employment s null and rather than leaving that to the in the first instance, the state court ignored a basic tenet of the Act's substantive law. The decision must be vacated. This dispute arises from a between petitioner Nitro-Lift Technologies, L.L.C. and two of its former employees. Nitro-Lift s with operators of oil and gas wells to provide services that enhance production. Respondents Eddie Lee Howard and Shane D. Schneider entered a confidentiality and noncompetition agreement with Nitro-Lift that contained the following QUOTED TEXT Petition for After working for Nitro-Lift on wells in Oklahoma, Texas, and Arkansas, respondents quit and began working for one of Nitro-Lift's competitors. Claiming that respondents had breached their noncompetition agreements, Nitro-Lift served them with a demand for Respondents then filed in the District Court of Johnston County, Oklahoma, asking the court to declare the noncompetition agreements null and and to enjoin their enforcement. The court dismissed the complaint, finding that the s contained valid s under which an and not the court, must the parties' disagreement. The Oklahoma retained respondents' and ordered the parties to show cause why the matter should not be resolved by application of Oklahoma , A (West ), which limits the enforceability of noncompetition agreements. Nitro-Lift argued that any dispute as to the s' enforceability was a question for the It relied for support as it had done before the court upon several of this Court's cases interpreting the FAA, and noted that under Buckeye Check Cashing, Inc. versus Cardegna, U.S. QUOTED TEXT Record in Number (Oklahoma), p. The Oklahoma was not persuaded. It held that despite the QUOTED TEXT the QUOTED TEXT OK n. P. , n. . For that proposition, the court relied on the QUOTED TEXT in Bruner versus Timberlane Manor Ltd. Partnership, OK P. which found jurisprudence QUOTED TEXT P. d, at Finding the s no obstacle to its review, the court held that the noncompetition agreements were QUOTED TEXT expressed in Oklahoma , A. P. d, at The Oklahoma declared that its decision rests on adequate and independent state grounds. If that were so, we would have no over this case. See Michigan versus Long, U.S. ). It is not so, however, because the court's reliance on Oklahoma law was not QUOTED TEXT it necessarily depended upon a rejection of the federal which was both QUOTED TEXT and QUOTED TEXT the state court. Howell versus Mississippi, U.S. (per curiam) (quoting Adams versus Robertson, U.S. (per curiam)). Nitro-Lift ed that the should decide the 's validity, and raised a federal-law basis for that by relying on cases construing the FAA. QUOTED TEXT Howell, at (quoting Baldwin versus Reese, U.S. emphasis added). The Oklahoma acknowledged the cases on which Nitro-Lift relied, as well as their relevant holdings, but chose to discount these controlling decisions. Its conclusion that, despite this Court's jurisprudence, the underlying 's validity is purely a matter of state law for state-court is all the more reason for this Court to assert The Oklahoma 's decision disregards this Court's precedents on the FAA. That Act, which QUOTED TEXT Southland Corp. versus Keating, U.S. provides that a QUOTED TEXT U.S.C. It is well that QUOTED TEXT Southland Corp., at see also Buckeye, at And when parties commit to arbitrate ual disputes, it is a mainstay of the Act's substantive law that attacks on the validity of the as distinct from attacks on the validity of the itself, are to be resolved QUOTED TEXT Preston versus Ferrer, U.S. see also Prima Paint Corp. versus Flood Conklin Mfg. Co., U.S. For these purposes, an QUOTED TEXT Buckeye, at and its validity is subject to initial court but the validity of the remainder of the (if the provision is valid) is for the to decide. This principle requires that the decision below be vacated. The court found that the contained a valid and the Oklahoma did not hold otherwise. It nonetheless assumed the 's role by declaring the noncompetition agreements null and The state court insisted that its QUOTED TEXT and permits review of a QUOTED TEXT P. d, at But the Oklahoma must abide by the FAA, which is QUOTED TEXT U.S. Constitution,Article I, cl. and by the opinions of this Court interpreting that law. QUOTED TEXT Our cases hold that the FAA forecloses precisely this type of QUOTED TEXT AT&T Mobility LLC versus Concepcion, U.S. (slip opinion, at ). The state court reasoned that Oklahoma's QUOTED TEXT P. d, at n. But the ancient interpretive principle that the specific governs the general (generalia specialibus non derogant) applies only to conflict between laws of equivalent dignity. And the same is true where a specific state conflicts with a general federal There is no general-specific exception to the Supremacy U.S. ConstitutionArticle I, cl. QUOTED TEXT Marmet Health Care Center, Inc. versus Brown, U.S. (per curiam) (slip opinion, at (quoting AT&T Mobility LLC, at (slip opinion, at )). Hence, it is for the to decide in the first instance whether the covenants not to compete are valid as a matter of applicable state law. See Buckeye, U.S. at For the foregoing reasons, the petition for is granted. The judgment of the of Oklahoma is vacated, and the case is remanded for proceedings not inconsistent with this opinion. It is so ordered.",6824,1089,48,22.35,11.62,367,39.76,340,"than,upon,to,the,the,It,a,of,therefore,that,to,a,of,the,the,to,so,By,the,in,and,than,that,to,the,in,the,the,a,of,the,The,This,from,a,between,and,of,its,with,of,and,to,that,and,a,and,with,that,the,for,After,for,on,in,and,and,for,one,of,that,their,with,a,for,in,the,of,the,to,the,and,and,to,their,The,the,that,the,under,which,and,the,the,The,and,the,to,the,by,of,which,the,of,that,any,as,to,the,a,for,the,It,for,as,it,before,the,upon,several,of,this,the,and,that,under,in,The,It,that,the,the,For,that,the,on,the,in,which,at,the,no,to,its,the,that,the,in,at,The,that,its,on,and,If,that,so,we,no,over,this,It,so,however,because,the,on,it,upon,a,of,the,which,both,and,the,per,per,that,the,the,and,a,for,that,by,on,the,at,The,the,on,which,as,as,their,but,to,these,Its,that,this,the,a,of,for,all,the,for,this,to,The,this,on,the,That,which,that,a,It,that,at,at,And,when,to,it,a,of,the,that,on,the,of,the,as,from,on,the,of,the,to,For,these,at,and,its,to,but,the,of,the,of,the,if,the,for,the,to,This,that,the,below,The,that,the,a,and,the,It,the,by,the,and,The,that,its,and,of,a,at,But,the,by,the,which,and,by,the,of,this,that,Our,that,the,this,of,at,The,that,at,But,the,that,the,the,to,between,of,And,the,where,a,with,a,no,to,the,per,at,at,at,it,for,the,to,in,the,whether,the,to,as,a,of,at,For,the,the,for,The,of,the,of,and,the,for,with,this,It,so",0,0.0,67,6.15,"claim,certiorari,jurisdiction,trial,settle,Title,arbitration,contract,supra,appeal,suit,arbitrator,Arbitration,void,Clause,Supreme Court,determination,Certiorari,clause,Statute,statute",62.91,0.82,9.15,3,0,10,3,1,0,1,0,0,0,0,0,1,0,2,0,0,2,0,0,1,6,2,0,0,0,0,0,1,83,8,2,0,0,1,0,2,0,0,3,0,1,0,0,3,0,0,0,1,0,4,1,6,1,0,0,0,0,0,0,27,0,0,0,0,23,0,0,0,13,0,0,0,0,11,20,7,0,0,1,6,0,0,0,0,0,0,0,0,0,0,1,2,0,1,1,0,0,24,1,0,0,0,0,0,5,0,0,0,0,0,4,9,0,0,0,0,0,0,17,0,0,1,0,0,0,0,1,0,0,16,0,4.878
case-574-21,unknown," Over days in April Joshua Frost helped two associates commit a series of armed robberies in the State of Washington. In the main, Frost drove his confederates to and from their crimes. On one occasion, he also entered the house being robbed. On another, he performed surveillance in anticipation of the Washington charged Frost with and related offenses. Taking the stand, Frost admitted to his involvement, but claimed he acted under As closing arguments drew near, however, Frost's lawyer expressed the desire to contend both that the State failed to meet its burden of proving that Frost was an to the crimes and that Frost acted under The insisted that the defense choose between these alternative arguments, explaining that state law prohibited a from simultaneously contesting the elements of the crime and presenting the affirmative defense of So Frost's lawyer limited his summation to The convicted Frost of six counts of one count of attempted one count of and two counts of The Washington sustained Frost's It rejected the court's view that state law prohibited Frost from simultaneously contesting criminal and arguing By preventing the defense from presenting both theories during summation, it said, the court violated the National Constitution's Due Process and Assistance of s. But the State continued, this improper of closing argument qualified as a error (a mistake reviewable for harmlessness) rather than a structural error (a mistake that requires automatic reversal). Because the heard three taped confessions and Frost's of guilt on the stand, and because it received proper instructions on the State's burden of proof, the State held that any error was harmless beyond a reasonable doubt. Frost filed a petition for of habeas under28 U.S.C. The District Court dismissed the petition, appendix to petition for of a, and a of the Court of Appeals affirmed, Frost versus an Boening, Federal (CA9 ). But the Court of Appeals en banc reversed and instructed the District Court to grant relief. Under the Antiterrorism and Effective Death Act of (AEDPA), the Court of Appeals had power to grant Frost habeas only if the Washington 's decision QUOTED TEXT or QUOTED TEXT28 U.S.C. Here, the Ninth held that the Washington unreasonably applied clearly established federal law by failing to classify the court's of closing argument as structural error. That decision cannot stand. Assuming for argument's sake that the court violated the Constitution, it was not clearly established that its mistake ranked as structural error. Most constitutional mistakes call for reversal only if the government cannot demonstrate harmlessness. Only the rare type of error in general, one that QUOTED TEXT and QUOTED TEXT requires automatic reversal. None of our cases clearly requires placing improper of closing argument in this narrow category. The Ninth claimed that the Washington contradicted Herring versus New York, U.S. ). Herring held that complete denial of summation violates the Assistance of According to the Ninth Herring further held that this denial amounts to structural error. We need not opine on the accuracy of that interpretation. For even assuming that Herring established that complete denial of summation amounts to structural error, it did not clearly establish that the of summation also amounts to structural error. A court could reasonably conclude, after all, that prohibiting all argument differs from prohibiting argument in the alternative. That is all the more true because our structural-error cases QUOTED TEXT Neder, at n. Attempting to bridge the gap between Herring and this case, the Ninth cited two s United States versus Miguel, Federal (CA9 ), and Conde versus Henry, Federal (CA9 for the proposition that QUOTED TEXT Federal d, at As we have repeatedly emphasized, however, does not constitute QUOTED TEXT ); see, e.g., Lopez versus Smith, U.S. (per curiam) (slip opinion, at ). The Ninth acknowledged this rule, but tried to get past it by claiming that could QUOTED TEXT Federal d, at n. But neither Miguel nor Conde arose under AEDPA, so neither purports to reflect the law clearly established by this Court's holdings. The Ninth thus had no for relying on those decisions. See Parker versus Matthews, U.S. (per curiam) (slip opinion, at ). The second rationale for the Court of Appeals' decision is no more sound than the first. The Ninth reasoned that, by allowing the to argue that it had proved the elements of the crimes, but QUOTED TEXT the defense from responding that it had not, the court in effect QUOTED TEXT Federal d, at By extracting this QUOTED TEXT the Ninth continued, the court QUOTED TEXT QUOTED TEXT and even QUOTED TEXT all QUOTED TEXT Id., at Number The court, to begin, did not prohibit the defense from arguing that the failed to prove the elements of the crime. It instead precluded the defense from simultaneously contesting reasonable doubt and claiming Reasonable minds could disagree whether requiring the defense to choose between alternative theories amounts to requiring the defense to concede guilt. Still more could they disagree whether it amounts to eliminating the 's burden of proof, shifting the burden to the or directing a In addition, even if the court's ruling somehow QUOTED TEXT the defense QUOTED TEXT id., at the Ninth still would have no basis for ruling as it did. It goes much too far to suggest that our cases clearly establish that this supposed extraction of a QUOTED TEXT is structural error, when they classify the introduction of a coerced confession only as error, Arizona versus Fulminante, U.S. ). Frost argued below that, even if it was reasonable for the State to treat improper of summation as error, it was unreasonable for it to find harmlessness on the facts of this case. The Court of Appeals did not address this argument when sitting en banc, and it is not before us today. We grant the petition for a of and 's motion to proceed in forma pauperis. We reverse the judgment of the Court of Appeals for the Ninth and the case for further proceedings consistent with this opinion. It is so ordered.",7070,1127,51,21.78,10.85,383,43.21,400,"Over,in,a,of,in,the,of,In,the,his,to,and,from,their,On,one,he,the,On,another,he,in,of,the,with,and,the,to,his,but,he,under,As,near,however,the,to,both,that,the,to,its,of,that,to,the,and,that,under,The,that,the,between,these,that,a,from,the,of,the,and,the,of,So,his,to,The,of,of,one,of,one,of,and,of,The,It,the,that,from,and,By,the,from,both,during,it,the,the,and,of,But,the,this,of,as,a,a,for,than,a,a,that,Because,the,and,of,on,the,and,because,it,on,the,of,the,that,any,beyond,a,a,for,of,The,the,to,for,of,and,a,of,the,of,But,the,of,and,the,to,Under,the,and,of,the,of,to,if,the,or,the,that,the,by,to,the,of,as,That,for,that,the,the,it,that,its,as,for,if,the,the,of,in,one,that,and,None,of,our,of,in,this,The,that,the,that,of,the,of,to,the,that,this,to,We,on,the,of,that,For,that,that,of,to,it,that,the,of,to,A,after,all,that,all,from,in,the,That,all,the,because,our,at,to,the,between,and,this,the,and,for,the,that,at,As,we,however,per,at,The,this,but,to,past,it,by,that,at,But,neither,nor,under,so,neither,to,the,by,this,The,thus,no,for,on,those,per,at,The,for,the,of,no,than,the,The,that,by,the,to,that,it,the,of,the,but,the,from,that,it,the,in,at,By,this,the,the,and,all,at,The,to,the,from,that,the,to,the,of,the,It,the,from,and,whether,the,to,between,to,the,to,they,whether,it,to,the,of,the,to,the,or,a,In,if,the,the,i,at,the,no,for,as,it,It,to,that,our,that,this,of,a,when,they,the,of,a,as,below,that,if,it,for,the,to,of,as,it,for,it,to,on,the,of,this,The,of,this,when,and,it,before,We,the,for,a,of,and,to,in,We,the,of,the,of,for,the,and,the,for,with,this,It,so",0,0.0,85,7.54,"habeas corpus,certiorari,Counsel,trial,robbery,restriction,justification,accomplice,supra,admission,verdict,conviction,duress,burglary,judge,defendant,jury,respondent,writ,Penalty,Clause,prosecution,remand,Supreme Court,assault,panel,precedent,corpus,circuit,Circuit,witness,liability",62.76,0.83,8.75,1,0,11,2,1,0,2,3,0,0,0,0,3,0,3,0,0,4,0,0,1,8,8,0,0,0,1,0,1,87,10,1,0,1,2,0,4,0,0,3,0,0,0,0,0,0,0,0,1,1,3,4,2,3,1,2,0,0,0,0,31,0,0,0,0,20,1,1,0,8,0,0,0,0,17,29,0,1,1,4,6,0,0,0,0,3,0,0,2,0,0,1,2,0,0,4,0,2,43,0,0,0,0,0,0,2,0,0,0,0,0,6,7,0,0,0,0,1,0,14,0,0,2,0,0,0,0,2,0,0,15,1,4.976
